{
  "schema_version": "1.0",
  "report_id": "616edb38-a920-496f-9e70-2b82543e4702",
  "token": "0f1e2d3c4b5a69788796a5b4c3d2e1f0",
  "session_id": "01a15df9-9480-78bd-98a1-a021f6e0e2f9",
  "language": "hi-IN",
  "report_mode": "thank_you",
  "demo_profile_id": null,
  "traits_shown": [],
  "disclaimer_key": "report.disclaimer.snapshot",
  "norm_table_version": null,
  "norm_provisional": true,
  "release_pack_version": null,
  "bundle_hash": "0000000000000000000000000000000000000000000000000000000000000b0b",
  "delivery_modes": ["spoken", "printed", "qr"],
  "created_at": "2026-10-21T10:34:00+05:30",
  "expires_at": "2026-10-24T10:34:00+05:30"
}
