{
  "schema_version": "1.0",
  "report_id": "02388229-3c60-4f41-9bd2-5719fed6b59e",
  "token": "0f1e2d3c4b5a69788796a5b4c3d2e1f0",
  "session_id": "01a15df9-9480-78bd-98a1-a021f6e0e2f9",
  "language": "hi-IN",
  "report_mode": "demo",
  "demo_profile_id": "demo.profile_a",
  "traits_shown": [
    {
      "trait": "persistence",
      "band": "pole_b",
      "phrase_key": "report.persistence.pole_b"
    },
    {
      "trait": "teamwork",
      "band": "centre",
      "phrase_key": "report.teamwork.centre"
    },
    {
      "trait": "adaptability",
      "band": "pole_a",
      "phrase_key": "report.adaptability.pole_a"
    }
  ],
  "disclaimer_key": "report.disclaimer.snapshot",
  "norm_table_version": null,
  "norm_provisional": true,
  "release_pack_version": null,
  "bundle_hash": "0000000000000000000000000000000000000000000000000000000000000b0b",
  "delivery_modes": ["spoken", "printed", "qr"],
  "created_at": "2026-10-21T10:34:00+05:30",
  "expires_at": "2026-10-24T10:34:00+05:30"
}
